Gene_set,Term,Overlap,P-value,Adjusted P-value,Old P-value,Old Adjusted P-value,Odds Ratio,Combined Score,Genes
GO_Biological_Process_2023,Axo-Dendritic Transport (GO:0008088),2/5,1.047992739884236e-05,0.0031963778566469,0,0,700.9122807017544,8036.694419732441,DCTN1;SPG11
GO_Biological_Process_2023,Maintenance Of Synapse Structure (GO:0099558),2/10,4.701125562718392e-05,0.0047794776554303,0,0,262.7763157894737,2618.598440635737,DCTN1;CHCHD10
GO_Biological_Process_2023,Synaptic Vesicle Transport (GO:0048489),2/10,4.701125562718392e-05,0.0047794776554303,0,0,262.7763157894737,2618.598440635737,KIF5A;SPG11
GO_Biological_Process_2023,Synaptic Vesicle Localization (GO:0097479),2/13,8.133190135805304e-05,0.0062015574785515,0,0,191.08133971291863,1799.4076693173631,KIF5A;SPG11
GO_Biological_Process_2023,Establishment Of Vesicle Localization (GO:0051650),2/18,0.0001590322318968525,0.0080841384547566,0,0,131.33552631578948,1148.7135280506443,KIF5A;SPG11
GO_Biological_Process_2023,Cell Junction Maintenance (GO:0034331),2/18,0.0001590322318968525,0.0080841384547566,0,0,131.33552631578948,1148.7135280506443,DCTN1;CHCHD10
GO_Biological_Process_2023,Neuromuscular Junction Development (GO:0007528),2/24,0.0002857953111961309,0.0124525099878314,0,0,95.48803827751196,779.2048032433584,UNC13A;DCTN1
GO_Biological_Process_2023,Synapse Organization (GO:0050808),3/131,0.00033503432399616714,0.0127731836023538,0,0,25.84765625,206.81427223407923,UNC13A;DCTN1;CHCHD10
GO_Biological_Process_2023,Axonogenesis (GO:0007409),3/188,0.000959618491871664,0.0325204044467619,0,0,17.832432432432434,123.91712282511412,KIF5A;NEFH;SPG11
GO_Biological_Process_2023,Positive Regulation Of Protein Polymerization (GO:0032273),2/70,0.002429043875274,0.0637618452223927,0,0,30.821981424148607,185.55626686856675,DCTN1;PFN1
GO_Biological_Process_2023,Chemical Synaptic Transmission (GO:0007268),3/273,0.0027886675774635,0.0637618452223927,0,0,12.16604938271605,71.56303066196239,UNC13A;KIF5A;SPG11
GO_Biological_Process_2023,Positive Regulation Of Cellular Component Biogenesis (GO:0044089),2/93,0.004240848035768,0.0637618452223927,0,0,23.005205320994797,125.67725311699562,VCP;PFN1
GO_Biological_Process_2023,Positive Regulation Of Supramolecular Fiber Organization (GO:1902905),2/96,0.0045118499417907,0.0637618452223927,0,0,22.267637178051512,120.2685777556432,DCTN1;PFN1
GO_Biological_Process_2023,Positive Regulation Of Mitochondrial Membrane Potential (GO:0010918),1/5,0.0052394399724711,0.0637618452223927,0,0,249.6875,1311.2440590040192,VCP
GO_Biological_Process_2023,Negative Regulation Of Protein Localization To Chromatin (GO:0120186),1/5,0.0052394399724711,0.0637618452223927,0,0,249.6875,1311.2440590040192,VCP
GO_Biological_Process_2023,Macroautophagy (GO:0016236),2/104,0.0052727665104504,0.0637618452223927,0,0,20.512899896800825,107.59426458228975,VCP;SPG11
GO_Biological_Process_2023,Regulation Of Apoptotic Process (GO:0042981),4/705,0.0056773538929416,0.0637618452223927,0,0,6.470756062767475,33.46202682581497,SETX;VCP;SPTLC1;SIGMAR1
GO_Biological_Process_2023,Positive Regulation Of Cellular Component Organization (GO:0051130),2/113,0.0061944038237758,0.0637618452223927,0,0,18.841156946420103,95.79049566946637,VCP;DCTN1
GO_Biological_Process_2023,Synaptic Vesicle Docking (GO:0016081),1/6,0.0062841913325394,0.0637618452223927,0,0,199.74,1012.6254955871668,UNC13A
GO_Biological_Process_2023,IRE1-mediated Unfolded Protein Response (GO:0036498),1/6,0.0062841913325394,0.0637618452223927,0,0,199.74,1012.6254955871668,VAPB
GO_Biological_Process_2023,protein-DNA Covalent Cross-Linking Repair (GO:0106300),1/6,0.0062841913325394,0.0637618452223927,0,0,199.74,1012.6254955871668,VCP
GO_Biological_Process_2023,Vacuole Organization (GO:0007033),1/6,0.0062841913325394,0.0637618452223927,0,0,199.74,1012.6254955871668,SPG11
GO_Biological_Process_2023,Anterograde Dendritic Transport (GO:0098937),1/6,0.0062841913325394,0.0637618452223927,0,0,199.74,1012.6254955871668,KIF5A
GO_Biological_Process_2023,Dense Core Granule Cytoskeletal Transport (GO:0099519),1/6,0.0062841913325394,0.0637618452223927,0,0,199.74,1012.6254955871668,KIF5A
GO_Biological_Process_2023,Nucleotide Catabolic Process (GO:0009166),1/6,0.0062841913325394,0.0637618452223927,0,0,199.74,1012.6254955871668,VCP
GO_Biological_Process_2023,Protein Localization To Presynapse (GO:1905383),1/7,0.0073278982772855,0.0637618452223927,0,0,166.44166666666666,818.2383072102982,KIF5A
GO_Biological_Process_2023,Termination Of RNA Polymerase II Transcription (GO:0006369),1/7,0.0073278982772855,0.0637618452223927,0,0,166.44166666666666,818.2383072102982,SETX
GO_Biological_Process_2023,Positive Regulation Of Membrane Potential (GO:0045838),1/7,0.0073278982772855,0.0637618452223927,0,0,166.44166666666666,818.2383072102982,VCP
GO_Biological_Process_2023,Positive Regulation Of Microtubule Nucleation (GO:0090063),1/7,0.0073278982772855,0.0637618452223927,0,0,166.44166666666666,818.2383072102982,DCTN1
GO_Biological_Process_2023,protein-RNA Complex Disassembly (GO:0032988),1/7,0.0073278982772855,0.0637618452223927,0,0,166.44166666666666,818.2383072102982,VCP
GO_Biological_Process_2023,NADH Metabolic Process (GO:0006734),1/7,0.0073278982772855,0.0637618452223927,0,0,166.44166666666666,818.2383072102982,VCP
GO_Biological_Process_2023,Anterograde Axonal Protein Transport (GO:0099641),1/7,0.0073278982772855,0.0637618452223927,0,0,166.44166666666666,818.2383072102982,KIF5A
GO_Biological_Process_2023,Intermediate Filament Bundle Assembly (GO:0045110),1/7,0.0073278982772855,0.0637618452223927,0,0,166.44166666666666,818.2383072102982,NEFH
GO_Biological_Process_2023,Axo-Dendritic Protein Transport (GO:0099640),1/7,0.0073278982772855,0.0637618452223927,0,0,166.44166666666666,818.2383072102982,KIF5A
GO_Biological_Process_2023,Protein Homooligomerization (GO:0051260),2/129,0.0080006077545453,0.0637618452223927,0,0,16.454206382096974,79.44482074372523,ALS2;SIGMAR1
GO_Biological_Process_2023,Positive Regulation Of ATP Biosynthetic Process (GO:2001171),1/8,0.0083705616816055,0.0637618452223927,0,0,142.65714285714284,682.3340060288631,VCP
GO_Biological_Process_2023,Regulation Of DNA-templated Transcription Initiation (GO:2000142),1/8,0.0083705616816055,0.0637618452223927,0,0,142.65714285714284,682.3340060288631,SETX
GO_Biological_Process_2023,Nuclear Membrane Disassembly (GO:0051081),1/8,0.0083705616816055,0.0637618452223927,0,0,142.65714285714284,682.3340060288631,DCTN1
GO_Biological_Process_2023,Organelle Organization (GO:0006996),3/418,0.0091134428023617,0.0637618452223927,0,0,7.857028112449799,36.91235519252756,VAPB;CHCHD10;CFAP410
GO_Biological_Process_2023,Regulation Of Protein Localization To Chromatin (GO:1905634),1/9,0.0094121824505319,0.0637618452223927,0,0,124.81875,582.3731356633181,VCP
GO_Biological_Process_2023,ER-associated Misfolded Protein Catabolic Process (GO:0071712),1/9,0.0094121824505319,0.0637618452223927,0,0,124.81875,582.3731356633181,VCP
GO_Biological_Process_2023,Positive Regulation Of Mitochondrial Membrane Permeability (GO:0035794),1/9,0.0094121824505319,0.0637618452223927,0,0,124.81875,582.3731356633181,CHCHD10
GO_Biological_Process_2023,Positive Regulation Of ATP Metabolic Process (GO:1903580),1/9,0.0094121824505319,0.0637618452223927,0,0,124.81875,582.3731356633181,VCP
GO_Biological_Process_2023,Neuron Projection Morphogenesis (GO:0048812),2/146,0.0101483167297973,0.0637618452223927,0,0,14.499269005847951,66.55813209657859,ALS2;NEFH
GO_Biological_Process_2023,Microtubule Anchoring At Centrosome (GO:0034454),1/10,0.0104527615118676,0.0637618452223927,0,0,110.94444444444444,506.0053047065427,DCTN1
GO_Biological_Process_2023,Positive Regulation Of Mitochondrial Outer Membrane Permeabilization Involved In Apoptotic Signaling Pathway (GO:1901030),1/10,0.0104527615118676,0.0637618452223927,0,0,110.94444444444444,506.0053047065427,CHCHD10
GO_Biological_Process_2023,Regulation Of Microtubule Nucleation (GO:0010968),1/10,0.0104527615118676,0.0637618452223927,0,0,110.94444444444444,506.0053047065427,DCTN1
GO_Biological_Process_2023,Positive Regulation Of Cellular Respiration (GO:1901857),1/10,0.0104527615118676,0.0637618452223927,0,0,110.94444444444444,506.0053047065427,VCP
GO_Biological_Process_2023,Neuron Projection Maintenance (GO:1990535),1/10,0.0104527615118676,0.0637618452223927,0,0,110.94444444444444,506.0053047065427,DCTN1
GO_Biological_Process_2023,Negative Regulation Of Centrosome Duplication (GO:0010826),1/10,0.0104527615118676,0.0637618452223927,0,0,110.94444444444444,506.0053047065427,CCNF
GO_Biological_Process_2023,Regulation Of Microtubule-Based Movement (GO:0060632),1/11,0.0114922998030339,0.0656977246670109,0,0,99.845,445.9155629250324,NEFH
GO_Biological_Process_2023,Endoplasmic Reticulum Membrane Organization (GO:0090158),1/11,0.0114922998030339,0.0656977246670109,0,0,99.845,445.9155629250324,VAPB
GO_Biological_Process_2023,Cell Projection Assembly (GO:0030031),1/12,0.0125307982775315,0.0656977246670109,0,0,90.76363636363637,397.5053179562565,NEFH
GO_Biological_Process_2023,Microtubule Anchoring At Microtubule Organizing Center (GO:0072393),1/12,0.0125307982775315,0.0656977246670109,0,0,90.76363636363637,397.5053179562565,DCTN1
GO_Biological_Process_2023,Positive Regulation Of Purine Nucleotide Biosynthetic Process (GO:1900373),1/12,0.0125307982775315,0.0656977246670109,0,0,90.76363636363637,397.5053179562565,VCP
GO_Biological_Process_2023,Positive Regulation Of Ruffle Assembly (GO:1900029),1/12,0.0125307982775315,0.0656977246670109,0,0,90.76363636363637,397.5053179562565,PFN1
GO_Biological_Process_2023,Double-Strand Break Repair (GO:0006302),2/168,0.0132643589781189,0.0656977246670109,0,0,12.563728598604946,54.308910706348165,SETX;VCP
GO_Biological_Process_2023,Sphingoid Biosynthetic Process (GO:0046520),1/13,0.0135682578861655,0.0656977246670109,0,0,83.19583333333334,357.74392971285124,SPTLC1
GO_Biological_Process_2023,Sphingosine Biosynthetic Process (GO:0046512),1/13,0.0135682578861655,0.0656977246670109,0,0,83.19583333333334,357.74392971285124,SPTLC1
GO_Biological_Process_2023,Cellular Response To Arsenic-Containing Substance (GO:0071243),1/13,0.0135682578861655,0.0656977246670109,0,0,83.19583333333334,357.74392971285124,VCP
GO_Biological_Process_2023,Calcium Ion-Regulated Exocytosis Of Neurotransmitter (GO:0048791),1/14,0.0146046795939876,0.0656977246670109,0,0,76.79230769230769,324.5560291468294,UNC13A
GO_Biological_Process_2023,Protein Homotrimerization (GO:0070207),1/14,0.0146046795939876,0.0656977246670109,0,0,76.79230769230769,324.5560291468294,SIGMAR1
GO_Biological_Process_2023,Protein Trimerization (GO:0070206),1/14,0.0146046795939876,0.0656977246670109,0,0,76.79230769230769,324.5560291468294,SIGMAR1
GO_Biological_Process_2023,Regulation Of ATP Biosynthetic Process (GO:2001169),1/14,0.0146046795939876,0.0656977246670109,0,0,76.79230769230769,324.5560291468294,VCP
GO_Biological_Process_2023,Positive Regulation Of Protein-Containing Complex Disassembly (GO:0043243),1/14,0.0146046795939876,0.0656977246670109,0,0,76.79230769230769,324.5560291468294,SETX
GO_Biological_Process_2023,Endosomal Transport (GO:0016197),2/180,0.0151185078054929,0.0656977246670109,0,0,11.709639266706091,49.08488277896939,ALS2;DCTN1
GO_Biological_Process_2023,Retrograde Axonal Transport (GO:0008090),1/15,0.0156400643604775,0.0656977246670109,0,0,71.30357142857143,296.4745049823623,KIF5A
GO_Biological_Process_2023,Endoplasmic Reticulum To Cytosol Transport (GO:1903513),1/15,0.0156400643604775,0.0656977246670109,0,0,71.30357142857143,296.4745049823623,VCP
GO_Biological_Process_2023,Endosome To Lysosome Transport Via Multivesicular Body Sorting Pathway (GO:0032510),1/15,0.0156400643604775,0.0656977246670109,0,0,71.30357142857143,296.4745049823623,VCP
GO_Biological_Process_2023,DNA-templated Transcription Termination (GO:0006353),1/16,0.0166744131586755,0.0656977246670109,0,0,66.54666666666667,272.4340597931688,SETX
GO_Biological_Process_2023,Neuron Projection Organization (GO:0106027),1/16,0.0166744131586755,0.0656977246670109,0,0,66.54666666666667,272.4340597931688,DCTN1
GO_Biological_Process_2023,Nuclear Migration (GO:0007097),1/16,0.0166744131586755,0.0656977246670109,0,0,66.54666666666667,272.4340597931688,DCTN1
GO_Biological_Process_2023,Neuron Projection Development (GO:0031175),2/192,0.0170782218264285,0.0656977246670109,0,0,10.96343490304709,44.62064508981883,ALS2;NEFH
GO_Biological_Process_2023,Regulation Of Cellular Respiration (GO:0043457),1/17,0.0177077269512865,0.0656977246670109,0,0,62.384375,251.6432336564321,VCP
GO_Biological_Process_2023,Membrane Lipid Metabolic Process (GO:0006643),1/17,0.0177077269512865,0.0656977246670109,0,0,62.384375,251.6432336564321,SPTLC1
GO_Biological_Process_2023,Regulation Of Aerobic Respiration (GO:1903715),1/17,0.0177077269512865,0.0656977246670109,0,0,62.384375,251.6432336564321,VCP
GO_Biological_Process_2023,"Retrograde Protein Transport, ER To Cytosol (GO:0030970)",1/17,0.0177077269512865,0.0656977246670109,0,0,62.384375,251.6432336564321,VCP
GO_Biological_Process_2023,Diol Biosynthetic Process (GO:0034312),1/17,0.0177077269512865,0.0656977246670109,0,0,62.384375,251.6432336564321,SPTLC1
GO_Biological_Process_2023,Positive Regulation Of Dendrite Extension (GO:1903861),1/17,0.0177077269512865,0.0656977246670109,0,0,62.384375,251.6432336564321,UNC13A
GO_Biological_Process_2023,Regulation Of Oxidative Phosphorylation (GO:0002082),1/17,0.0177077269512865,0.0656977246670109,0,0,62.384375,251.6432336564321,VCP
GO_Biological_Process_2023,Endomembrane System Organization (GO:0010256),2/196,0.0177544554426093,0.0656977246670109,0,0,10.735214324470972,43.27492411050007,ALS2;VAPB
GO_Biological_Process_2023,Anterograde Trans-Synaptic Signaling (GO:0098916),2/199,0.0182690740502533,0.0656977246670109,0,0,10.57013091103393,42.307430877504046,KIF5A;SPG11
GO_Biological_Process_2023,Maintenance Of Protein Localization In Organelle (GO:0072595),1/18,0.0187400067082949,0.0656977246670109,0,0,58.71176470588235,233.50224496360525,CHCHD10
GO_Biological_Process_2023,Maintenance Of Protein Location In Nucleus (GO:0051457),1/18,0.0187400067082949,0.0656977246670109,0,0,58.71176470588235,233.50224496360525,CHCHD10
GO_Biological_Process_2023,Regulation Of Dendrite Extension (GO:1903859),1/18,0.0187400067082949,0.0656977246670109,0,0,58.71176470588235,233.50224496360525,UNC13A
GO_Biological_Process_2023,Regulation Of Mitochondrial Outer Membrane Permeabilization Involved In Apoptotic Signaling Pathway (GO:1901028),1/18,0.0187400067082949,0.0656977246670109,0,0,58.71176470588235,233.50224496360525,CHCHD10
GO_Biological_Process_2023,Neuromuscular Process (GO:0050905),1/18,0.0187400067082949,0.0656977246670109,0,0,58.71176470588235,233.50224496360525,DCTN1
GO_Biological_Process_2023,Sphingosine Metabolic Process (GO:0006670),1/19,0.0197712534056807,0.0677554189745238,0,0,55.44722222222222,217.54863156976407,SPTLC1
GO_Biological_Process_2023,Cellular Response To Misfolded Protein (GO:0071218),1/19,0.0197712534056807,0.0677554189745238,0,0,55.44722222222222,217.54863156976407,VCP
GO_Biological_Process_2023,Cell Projection Organization (GO:0030030),1/20,0.0208014680109953,0.0682198682081029,0,0,52.526315789473685,203.4203291515269,NEFH
GO_Biological_Process_2023,Regulation Of Spindle Organization (GO:0090224),1/20,0.0208014680109953,0.0682198682081029,0,0,52.526315789473685,203.4203291515269,DCTN1
GO_Biological_Process_2023,Transport Along Microtubule (GO:0010970),1/20,0.0208014680109953,0.0682198682081029,0,0,52.526315789473685,203.4203291515269,SPG11
GO_Biological_Process_2023,Response To Fibroblast Growth Factor (GO:0071774),1/20,0.0208014680109953,0.0682198682081029,0,0,52.526315789473685,203.4203291515269,SETX
GO_Biological_Process_2023,NAD Metabolic Process (GO:0019674),1/22,0.0228588048336812,0.072624327857008,0,0,47.51904761904762,179.54686782262274,VCP
GO_Biological_Process_2023,Vesicle Transport Along Microtubule (GO:0047496),1/22,0.0228588048336812,0.072624327857008,0,0,47.51904761904762,179.54686782262274,KIF5A
GO_Biological_Process_2023,Postreplication Repair (GO:0006301),1/22,0.0228588048336812,0.072624327857008,0,0,47.51904761904762,179.54686782262274,VCP
GO_Biological_Process_2023,Translesion Synthesis (GO:0019985),1/23,0.0238859289927226,0.073587963058388,0,0,45.35681818181818,169.38348350725923,VCP
GO_Biological_Process_2023,Negative Regulation Of Actin Filament Polymerization (GO:0030837),1/23,0.0238859289927226,0.073587963058388,0,0,45.35681818181818,169.38348350725923,PFN1
GO_Biological_Process_2023,Axon Extension (GO:0048675),1/23,0.0238859289927226,0.073587963058388,0,0,45.35681818181818,169.38348350725923,SPG11
GO_Biological_Process_2023,Protein Exit From Endoplasmic Reticulum (GO:0032527),1/24,0.0249120249496479,0.0737686175693457,0,0,43.38260869565217,160.18614661402282,VCP
GO_Biological_Process_2023,Protein Kinase B Signaling (GO:0043491),1/24,0.0249120249496479,0.0737686175693457,0,0,43.38260869565217,160.18614661402282,SETX
GO_Biological_Process_2023,Regulation Of Ruffle Assembly (GO:1900027),1/24,0.0249120249496479,0.0737686175693457,0,0,43.38260869565217,160.18614661402282,PFN1
GO_Biological_Process_2023,Endosome Transport Via Multivesicular Body Sorting Pathway (GO:0032509),1/24,0.0249120249496479,0.0737686175693457,0,0,43.38260869565217,160.18614661402282,VCP
GO_Biological_Process_2023,Positive Regulation Of Peptidase Activity (GO:0010952),1/25,0.0259370936730085,0.0740824011001314,0,0,41.57291666666666,151.8276651730302,VCP
GO_Biological_Process_2023,Negative Regulation Of Smoothened Signaling Pathway (GO:0045879),1/25,0.0259370936730085,0.0740824011001314,0,0,41.57291666666666,151.8276651730302,VCP
GO_Biological_Process_2023,Negative Regulation Of Stress Fiber Assembly (GO:0051497),1/25,0.0259370936730085,0.0740824011001314,0,0,41.57291666666666,151.8276651730302,PFN1
GO_Biological_Process_2023,Cilium Assembly (GO:0060271),2/243,0.0265234311963488,0.0740824011001314,0,0,8.621096309237824,31.292223806690696,DCTN1;NEK1
GO_Biological_Process_2023,Positive Regulation Of Microtubule Polymerization Or Depolymerization (GO:0031112),1/26,0.0269611361380806,0.0740824011001314,0,0,39.908,144.2019250738276,DCTN1
GO_Biological_Process_2023,Negative Regulation Of Protein Polymerization (GO:0032272),1/26,0.0269611361380806,0.0740824011001314,0,0,39.908,144.2019250738276,PFN1
GO_Biological_Process_2023,Regulation Of Actin Filament Bundle Assembly (GO:0032231),1/26,0.0269611361380806,0.0740824011001314,0,0,39.908,144.2019250738276,PFN1
GO_Biological_Process_2023,Nuclear Membrane Organization (GO:0071763),1/26,0.0269611361380806,0.0740824011001314,0,0,39.908,144.2019250738276,DCTN1
GO_Biological_Process_2023,DNA Synthesis Involved In DNA Repair (GO:0000731),1/27,0.0279841533165139,0.0742188414046675,0,0,38.371153846153845,137.21973105106596,VCP
GO_Biological_Process_2023,"Synaptic Transmission, Glutamatergic (GO:0035249)",1/27,0.0279841533165139,0.0742188414046675,0,0,38.371153846153845,137.21973105106596,UNC13A
GO_Biological_Process_2023,Protein Quality Control For Misfolded Or Incompletely Synthesized Proteins (GO:0006515),1/27,0.0279841533165139,0.0742188414046675,0,0,38.371153846153845,137.21973105106596,VCP
GO_Biological_Process_2023,Regulation Of Actin Polymerization Or Depolymerization (GO:0008064),1/27,0.0279841533165139,0.0742188414046675,0,0,38.371153846153845,137.21973105106596,PFN1
GO_Biological_Process_2023,Negative Regulation Of Actin Filament Bundle Assembly (GO:0032232),1/28,0.0290061461687485,0.0745160717778608,0,0,36.94814814814815,130.8055903894323,PFN1
GO_Biological_Process_2023,Negative Regulation Of Cytoskeleton Organization (GO:0051494),1/28,0.0290061461687485,0.0745160717778608,0,0,36.94814814814815,130.8055903894323,PFN1
GO_Biological_Process_2023,mRNA Splice Site Recognition (GO:0006376),1/29,0.0300271156735161,0.0745160717778608,0,0,35.62678571428572,124.89519987020886,SETX
GO_Biological_Process_2023,Establishment Of Mitotic Spindle Orientation (GO:0000132),1/29,0.0300271156735161,0.0745160717778608,0,0,35.62678571428572,124.89519987020886,DCTN1
GO_Biological_Process_2023,Positive Regulation Of Microtubule Polymerization (GO:0031116),1/29,0.0300271156735161,0.0745160717778608,0,0,35.62678571428572,124.89519987020886,DCTN1
GO_Biological_Process_2023,RNA Biosynthetic Process (GO:0032774),1/29,0.0300271156735161,0.0745160717778608,0,0,35.62678571428572,124.89519987020886,SETX
GO_Biological_Process_2023,Positive Regulation Of Viral Genome Replication (GO:0045070),1/29,0.0300271156735161,0.0745160717778608,0,0,35.62678571428572,124.89519987020886,VAPB
GO_Biological_Process_2023,Cellular Component Assembly (GO:0022607),2/260,0.0300507437005799,0.0745160717778608,0,0,8.04610363117095,28.20053009184629,CHCHD10;NEFH
GO_Biological_Process_2023,Phospholipid Dephosphorylation (GO:0046839),1/30,0.0310470628007074,0.0763657593081916,0,0,34.39655172413793,119.43346355828848,FIG4
GO_Biological_Process_2023,Regulation Of Centrosome Duplication (GO:0010824),1/31,0.032065988516399,0.0776200515674738,0,0,33.248333333333335,114.37291539918964,CCNF
GO_Biological_Process_2023,Non-Motile Cilium Assembly (GO:1905515),1/31,0.032065988516399,0.0776200515674738,0,0,33.248333333333335,114.37291539918964,DCTN1
GO_Biological_Process_2023,Cellular Nitrogen Compound Biosynthetic Process (GO:0044271),1/32,0.0330838937893811,0.0788327156700098,0,0,32.174193548387095,109.67245370483884,SPTLC1
GO_Biological_Process_2023,Vesicle Budding From Membrane (GO:0006900),1/32,0.0330838937893811,0.0788327156700098,0,0,32.174193548387095,109.67245370483884,VAPB
GO_Biological_Process_2023,Regulation Of Protein Polymerization (GO:0032271),1/33,0.03410077958834,0.0800056751880284,0,0,31.1671875,105.2963181340018,PFN1
GO_Biological_Process_2023,Positive Regulation Of RNA Metabolic Process (GO:0051254),1/33,0.03410077958834,0.0800056751880284,0,0,31.1671875,105.2963181340018,SETX
GO_Biological_Process_2023,Establishment Of Mitotic Spindle Localization (GO:0040001),1/34,0.0351166468802889,0.0811407371097585,0,0,30.221212121212123,101.21325681429822,DCTN1
GO_Biological_Process_2023,Cellular Response To Hydrogen Peroxide (GO:0070301),1/34,0.0351166468802889,0.0811407371097585,0,0,30.221212121212123,101.21325681429822,SETX
GO_Biological_Process_2023,Establishment Of Spindle Orientation (GO:0051294),1/35,0.0361314966365463,0.0820965622672003,0,0,29.330882352941178,97.3958437550943,DCTN1
GO_Biological_Process_2023,DNA Repair (GO:0006281),2/291,0.0369357731916298,0.0820965622672003,0,0,7.1717355672919325,23.65650574387906,SETX;VCP
GO_Biological_Process_2023,Lytic Vacuole Organization (GO:0080171),1/36,0.0371453298127004,0.0820965622672003,0,0,28.49142857142857,93.81991597487811,SPG11
GO_Biological_Process_2023,COPII-coated Vesicle Budding (GO:0090114),1/36,0.0371453298127004,0.0820965622672003,0,0,28.49142857142857,93.81991597487811,VAPB
GO_Biological_Process_2023,Positive Regulation Of RNA Splicing (GO:0033120),1/36,0.0371453298127004,0.0820965622672003,0,0,28.49142857142857,93.81991597487811,SETX
GO_Biological_Process_2023,Interstrand Cross-Link Repair (GO:0036297),1/36,0.0371453298127004,0.0820965622672003,0,0,28.49142857142857,93.81991597487811,VCP
GO_Biological_Process_2023,Regulation Of Intracellular Transport (GO:0032386),1/38,0.0391699503023247,0.0833682010951599,0,0,26.94864864864865,87.3094553625357,NEFH
GO_Biological_Process_2023,Signal Release From Synapse (GO:0099643),1/38,0.0391699503023247,0.0833682010951599,0,0,26.94864864864865,87.3094553625357,UNC13A
GO_Biological_Process_2023,Fibroblast Growth Factor Receptor Signaling Pathway (GO:0008543),1/39,0.0401807395442246,0.0833682010951599,0,0,26.23815789473684,84.33908236365446,SETX
GO_Biological_Process_2023,Positive Regulation Of ATP-dependent Activity (GO:0032781),1/39,0.0401807395442246,0.0833682010951599,0,0,26.23815789473684,84.33908236365446,PFN1
GO_Biological_Process_2023,Regulation Of Mitochondrial Membrane Potential (GO:0051881),1/39,0.0401807395442246,0.0833682010951599,0,0,26.23815789473684,84.33908236365446,VCP
GO_Biological_Process_2023,Anterograde Axonal Transport (GO:0008089),1/39,0.0401807395442246,0.0833682010951599,0,0,26.23815789473684,84.33908236365446,KIF5A
GO_Biological_Process_2023,Regulation Of Mitotic Spindle Organization (GO:0060236),1/39,0.0401807395442246,0.0833682010951599,0,0,26.23815789473684,84.33908236365446,DCTN1
GO_Biological_Process_2023,Neuron Projection Extension (GO:1990138),1/39,0.0401807395442246,0.0833682010951599,0,0,26.23815789473684,84.33908236365446,SPG11
GO_Biological_Process_2023,Axonal Transport (GO:0098930),1/39,0.0401807395442246,0.0833682010951599,0,0,26.23815789473684,84.33908236365446,DCTN1
GO_Biological_Process_2023,Cellular Response To Heat (GO:0034605),1/40,0.0411905160666275,0.0835764977424408,0,0,25.56410256410257,81.53791281942478,VCP
GO_Biological_Process_2023,Negative Regulation Of Protein Localization (GO:1903828),1/40,0.0411905160666275,0.0835764977424408,0,0,25.56410256410257,81.53791281942478,VCP
GO_Biological_Process_2023,Regulation Of Microtubule Polymerization (GO:0031113),1/40,0.0411905160666275,0.0835764977424408,0,0,25.56410256410257,81.53791281942478,DCTN1
GO_Biological_Process_2023,Synaptic Vesicle Exocytosis (GO:0016079),1/41,0.0421992808273308,0.0835764977424408,0,0,24.92375,78.89244440466216,UNC13A
GO_Biological_Process_2023,Cellular Response To Retinoic Acid (GO:0071300),1/41,0.0421992808273308,0.0835764977424408,0,0,24.92375,78.89244440466216,SETX
GO_Biological_Process_2023,Positive Regulation Of Actin Filament Polymerization (GO:0030838),1/41,0.0421992808273308,0.0835764977424408,0,0,24.92375,78.89244440466216,PFN1
GO_Biological_Process_2023,Positive Regulation Of Viral Process (GO:0048524),1/41,0.0421992808273308,0.0835764977424408,0,0,24.92375,78.89244440466216,VAPB
GO_Biological_Process_2023,Ceramide Biosynthetic Process (GO:0046513),1/42,0.0432070348019609,0.0848125948167343,0,0,24.314634146341465,76.39054934861029,SPTLC1
